{
  "workflow_id": "ob_fixture_chain_v1",
  "schema_version": 1,
  "root_goal": "依次完成三步计算并汇总",
  "nodes": [
    {
      "id": "t1",
      "description": "解析输入数字列表",
      "task_type": "simple_qa",
      "depends_on": [],
      "outputs": ["numbers"],
      "constraints": [],
      "model": null,
      "estimated_output_tokens": 256,
      "duration_ms": 500
    },
    {
      "id": "t2",
      "description": "对列表求和并求平均",
      "task_type": "math_logic",
      "depends_on": ["t1"],
      "inputs": ["numbers"],
      "outputs": ["stats"],
      "constraints": [],
      "model": null,
      "estimated_output_tokens": 512,
      "duration_ms": 1200
    },
    {
      "id": "t3",
      "description": "用中文汇总结果",
      "task_type": "general",
      "depends_on": ["t2"],
      "inputs": ["stats"],
      "outputs": ["summary"],
      "constraints": [],
      "model": null,
      "estimated_output_tokens": 300,
      "duration_ms": 700
    }
  ],
  "edges": [
    { "from": "t1", "to": "t2", "type": "data" },
    { "from": "t2", "to": "t3", "type": "data" }
  ],
  "waves": [["t1"], ["t2"], ["t3"]],
  "aggregation": { "type": "final_synthesis" },
  "meta": {
    "source_benchmark": "fixture",
    "source_id": "chain",
    "purpose": "串行链基线：O-Day 11 sequential baseline 与 makespan 上界参照",
    "duration_basis": "手造 profile（模拟用，非实测）"
  }
}
